用户兴趣类别,标签,用户ID(oid)
情感,生活 清新 文字 情话 青春 随性 怀旧 心情 情感 文艺 ,3451447314
情感,同性 情感咨询 人生感悟 恋爱 情感,5873793239
情感,情感咨询 恋爱 人生感悟 情感两性 搞笑 美食 星座 电影 美妆 时尚,2615825191
情感,诗词 感悟人生 触动内心的一句 经典语录收集 爱情 友情 亲情 情感语录 浪漫温馨 唯美,1749975705
情感,美食 几米 漫画 80后 图片 语录 爱情,2451549504
情感,淡定 唱歌 盗墓笔记 心理学 微博 K歌 爱音乐 80后的尾巴 ,2924853791
情感,生活 清新 文字 情话 青春 随性 怀旧 心情 情感 文艺,3451447314
情感,生活 星座运势 交朋友 爱情 没事,3195646864
情感,情感 人生,2013911484
情感,情侣 恋爱 情感 狗粮 虐狗,3296926472
情感, 相亲 剩男剩女 幸福 生活 交友 恋爱 爱情 友情 亲情 情感 ,2154013651
情感,情感随笔 情感,2639424057
情感,随笔 爱情 两性 情感 病态 情话,2542180771
情感,读书 文字 90后 文化 情感 生活 时尚 经典 语录 爱情,1236380405
情感,情感生活 情感两性 情感专家 情感交流 爱情 爱情密码 经典语录 人生感悟 情感,2557582922
情感,情感 摄影 美食 旅行,1672418622
情感,潮流 时尚 第六感 情感感悟 网络经典 电影 旅游 健康 音乐,1742987084
情感,读物 写作 情感生活 八卦杂谈 美食,3900215081
情感,情感 生活  ,5489171304
情感,爱玩 快乐 梦想 创意 摄影控 文字控 搞怪 情感专家 情感交流 情感随笔,5984691065
情感,情感 男女 爱情 真实经历分享,3517499214
情感,情感随笔 情感生活 唯美 女性 音乐 交友 时尚 旅游 语录,2789169452
情感,情感专家 笔录 疗伤系 失恋 哲理感悟 心情感悟 爱情 语录 情感 文艺,3154810532
情感,美食 搞笑幽默 文艺 情感咨询 人生感悟 恋爱 语录 情感两性 八卦杂谈 美女,3913886039
情感, 情感随笔 情感生活 唯美 女性 音乐 交友 时尚 旅游 语录 ,2789169452
情感,韩系 潮流 时尚 90后 个性 文字,2976198084
情感, 语录 情感 ,2408562972
情感,心理 爱情 ,3071912693
情感, 有趣 有點宅 读物,2169653481
